{
  "$schema": "https://json-schema.org/draft/2020-12/schema",
  "type": "object",
  "properties": {
    "schema_version": {
      "enum": [
        "1.0",
        "1.1",
        "1.2"
      ]
    },
    "id": {
      "type": "string",
      "minLength": 1
    },
    "title": {
      "type": "string",
      "minLength": 1
    },
    "selected_goals": {
      "type": "array",
      "items": {
        "type": "string",
        "minLength": 1
      },
      "uniqueItems": true,
      "minItems": 1
    },
    "sources": {
      "type": "array",
      "items": {
        "type": "object",
        "properties": {
          "id": {
            "type": "string",
            "minLength": 1
          },
          "kind": {
            "enum": [
              "repository",
              "file",
              "literature",
              "synthetic",
              "api_snapshot"
            ]
          },
          "url": {
            "type": "string",
            "pattern": "^(https://[^ ]+|urn:[^ ]+)$"
          },
          "revision": {
            "type": "string",
            "minLength": 1
          },
          "license": {
            "type": "string",
            "minLength": 1
          },
          "redistribution": {
            "enum": [
              "vendored",
              "reference_only",
              "original"
            ]
          },
          "sha256": {
            "type": "string",
            "pattern": "^[0-9a-f]{64}$"
          },
          "path": {
            "type": "string",
            "minLength": 1
          },
          "observed_at": {
            "type": "string",
            "pattern": "^\\d{4}-\\d{2}-\\d{2}T\\d{2}:\\d{2}:\\d{2}(?:\\.\\d+)?(?:Z|[+-]\\d{2}:\\d{2})$"
          }
        },
        "required": [
          "id",
          "kind",
          "url",
          "revision",
          "license",
          "redistribution"
        ],
        "additionalProperties": false
      },
      "uniqueItems": true
    },
    "citations": {
      "type": "array",
      "items": {
        "type": "object",
        "properties": {
          "id": {
            "type": "string",
            "minLength": 1
          },
          "title": {
            "type": "string",
            "minLength": 1
          },
          "url": {
            "type": "string",
            "pattern": "^(https://[^ ]+|urn:[^ ]+)$"
          },
          "source_id": {
            "type": "string",
            "minLength": 1
          },
          "locator": {
            "type": "string",
            "minLength": 1
          }
        },
        "required": [
          "id",
          "title",
          "url",
          "source_id",
          "locator"
        ],
        "additionalProperties": false
      },
      "uniqueItems": true
    },
    "nodes": {
      "type": "array",
      "items": {
        "type": "object",
        "properties": {
          "id": {
            "type": "string",
            "minLength": 1
          },
          "kind": {
            "enum": [
              "goal",
              "declaration",
              "assumption",
              "claim"
            ]
          },
          "label": {
            "type": "string",
            "minLength": 1
          },
          "status": {
            "enum": [
              "unverified",
              "kernel_checked",
              "conditional",
              "open",
              "external",
              "axiom"
            ]
          },
          "source_id": {
            "type": "string",
            "minLength": 1
          },
          "locator": {
            "type": "string",
            "minLength": 1
          },
          "is_unsafe": {
            "type": "boolean"
          },
          "lean_kind": {
            "enum": [
              "axiom",
              "definition",
              "theorem",
              "opaque",
              "quotient_primitive",
              "inductive",
              "constructor",
              "recursor"
            ]
          },
          "is_partial": {
            "type": [
              "boolean",
              "null"
            ]
          },
          "declaration": {
            "type": "string",
            "minLength": 1
          },
          "statement": {
            "type": "string",
            "minLength": 1
          },
          "assumption_ids": {
            "type": "array",
            "items": {
              "type": "string",
              "minLength": 1
            },
            "uniqueItems": true
          },
          "evidence_ids": {
            "type": "array",
            "items": {
              "type": "string",
              "minLength": 1
            },
            "uniqueItems": true
          },
          "citation_ids": {
            "type": "array",
            "items": {
              "type": "string",
              "minLength": 1
            },
            "uniqueItems": true
          },
          "boundary": {
            "type": "string",
            "minLength": 1
          },
          "platform": {
            "type": "object",
            "additionalProperties": false,
            "required": [
              "provider",
              "id",
              "entity",
              "status",
              "visibility"
            ],
            "properties": {
              "provider": {
                "const": "prove2me"
              },
              "id": {
                "type": "string",
                "pattern": "^[0-9a-fA-F]{8}-[0-9a-fA-F]{4}-[0-9a-fA-F]{4}-[0-9a-fA-F]{4}-[0-9a-fA-F]{12}$"
              },
              "entity": {
                "enum": [
                  "theorem",
                  "definition"
                ]
              },
              "status": {
                "type": "string",
                "minLength": 1
              },
              "visibility": {
                "const": "public"
              },
              "mathlib_rev": {
                "type": "string",
                "minLength": 1
              }
            }
          }
        },
        "required": [
          "id",
          "kind",
          "label",
          "status",
          "assumption_ids",
          "evidence_ids",
          "citation_ids"
        ],
        "additionalProperties": false,
        "allOf": [
          {
            "if": {
              "properties": {
                "status": {
                  "const": "axiom"
                }
              }
            },
            "then": {
              "properties": {
                "kind": {
                  "const": "assumption"
                }
              }
            }
          }
        ]
      },
      "uniqueItems": true
    },
    "edges": {
      "type": "array",
      "items": {
        "type": "object",
        "properties": {
          "from": {
            "type": "string",
            "minLength": 1
          },
          "to": {
            "type": "string",
            "minLength": 1
          },
          "kind": {
            "enum": [
              "lean_type_dependency",
              "lean_value_dependency",
              "platform_decomposition",
              "formalizes",
              "supports",
              "cites",
              "lean_structural_dependency"
            ]
          },
          "evidence_ids": {
            "type": "array",
            "items": {
              "type": "string",
              "minLength": 1
            },
            "uniqueItems": true
          },
          "application": {
            "type": "object",
            "additionalProperties": false,
            "properties": {
              "status": {
                "const": "authored"
              },
              "shared_bindings": {
                "type": "object",
                "minProperties": 1,
                "propertyNames": {
                  "type": "string",
                  "minLength": 1
                },
                "additionalProperties": {
                  "type": "string",
                  "minLength": 1
                }
              },
              "premise_bindings": {
                "type": "array",
                "minItems": 1,
                "items": {
                  "type": "object",
                  "additionalProperties": false,
                  "properties": {
                    "assumption_id": {
                      "type": "string",
                      "minLength": 1
                    },
                    "supplier_id": {
                      "type": "string",
                      "minLength": 1
                    },
                    "binding_names": {
                      "type": "array",
                      "items": {
                        "type": "string",
                        "minLength": 1
                      },
                      "uniqueItems": true,
                      "minItems": 1
                    },
                    "rationale": {
                      "type": "string",
                      "minLength": 1
                    }
                  },
                  "required": [
                    "assumption_id",
                    "supplier_id",
                    "binding_names",
                    "rationale"
                  ]
                }
              },
              "remaining_assumption_ids": {
                "type": "array",
                "items": {
                  "type": "string",
                  "minLength": 1
                },
                "uniqueItems": true
              },
              "source_span": {
                "type": "object",
                "additionalProperties": false,
                "properties": {
                  "source_id": {
                    "type": "string",
                    "minLength": 1
                  },
                  "start_line": {
                    "type": "integer",
                    "minimum": 1
                  },
                  "end_line": {
                    "type": "integer",
                    "minimum": 1
                  }
                },
                "required": [
                  "source_id",
                  "start_line",
                  "end_line"
                ]
              },
              "rationale": {
                "type": "string",
                "minLength": 1
              }
            },
            "required": [
              "status",
              "shared_bindings",
              "premise_bindings",
              "remaining_assumption_ids",
              "source_span",
              "rationale"
            ]
          }
        },
        "required": [
          "from",
          "to",
          "kind",
          "evidence_ids"
        ],
        "additionalProperties": false
      },
      "uniqueItems": true
    },
    "evidence": {
      "type": "array",
      "items": {
        "type": "object",
        "properties": {
          "id": {
            "type": "string",
            "minLength": 1
          },
          "kind": {
            "enum": [
              "source_hash",
              "lean_build",
              "comparator",
              "extraction",
              "semantic_review",
              "platform_observation"
            ]
          },
          "status": {
            "enum": [
              "passed",
              "failed",
              "unavailable",
              "not_run"
            ]
          },
          "command": {
            "type": "array",
            "items": {
              "type": "string",
              "minLength": 1
            }
          },
          "tool": {
            "type": "string",
            "minLength": 1
          },
          "source_ids": {
            "type": "array",
            "items": {
              "type": "string",
              "minLength": 1
            },
            "uniqueItems": true
          },
          "subject_ids": {
            "type": "array",
            "items": {
              "type": "string",
              "minLength": 1
            },
            "uniqueItems": true
          },
          "details": {
            "type": "string",
            "minLength": 1
          },
          "receipt_path": {
            "type": "string",
            "minLength": 1
          },
          "receipt_sha256": {
            "type": "string",
            "pattern": "^[0-9a-f]{64}$"
          },
          "receipt": {
            "type": "object"
          }
        },
        "required": [
          "id",
          "kind",
          "status",
          "command",
          "tool",
          "source_ids",
          "subject_ids",
          "details"
        ],
        "additionalProperties": false
      },
      "uniqueItems": true
    },
    "scope": {
      "type": "string",
      "minLength": 1
    },
    "extraction_status": {
      "enum": [
        "not_run",
        "fixture",
        "partial",
        "complete"
      ]
    },
    "notes": {
      "type": "array",
      "items": {
        "type": "string",
        "minLength": 1
      },
      "uniqueItems": true
    }
  },
  "required": [
    "schema_version",
    "id",
    "title",
    "selected_goals",
    "sources",
    "citations",
    "nodes",
    "edges",
    "evidence",
    "scope",
    "extraction_status",
    "notes"
  ],
  "additionalProperties": false
}
